{"description": "Run the 12-gate binary rubric on a candidate. Logic mirrors rubric/campaign_gate.py exactly: REROUTE tracks short-circuit; any FAIL → REJECTED; any UNKNOWN → BLOCKED; else ELIGIBLE. UNKNOWN never silently becomes PASS.", "deterministic": true, "inputs": [{"from": "thesis + compiled evidence", "name": "candidate"}, {"from": "rubric thresholds (rubric_config.yaml shape)", "name": "thresholds", "required": false}], "op_id": "distill-gate-check", "outputs": [{"name": "verdict", "to": "{verdict: ELIGIBLE|BLOCKED|REJECTED|REROUTE|INVALID, failed[], unknown[], reason}"}], "params": {"gates": ["G1_installed_base", "G2_lifecycle_trigger", "G3_compatibility_graph", "G4_buyer_selection_autonomy", "G5_local_transactional_supply", "G6_decision_ownership_gap", "G7_reseller_path", "G8_economics", "G9_validated_demand", "G10_operational_burden", "G11_agentic_feed_eligibility", "G12_retrieval_whitespace"], "reroute_tracks": ["SERVICE_ORCHESTRATION", "B2B_RESOLUTION", "BENCHMARK"]}, "side_effect": 0, "sources": ["rubric/campaign_gate.py", "rubric/RUBRIC_A_BINARY_GATE.md", "rubric/TRACK_ROUTER.md", "CAMPAIGN_STATE_MACHINE.md"], "version": "v1"}