{"description": "Group candidates into thesis buckets by shared signals (mechanism/problem/country/pattern affinity). Buckets start PROPOSED — clustering suggests, evidence decides.", "deterministic": true, "inputs": [{"from": "distill-sprawl-scan.pools", "name": "candidates"}, {"from": "graph_edges (mechanism/problem links, optional)", "name": "affinities", "required": false}], "op_id": "distill-cluster", "outputs": [{"name": "theses", "to": "thesis buckets [{thesis_id, members[], shared_signals[], status: PROPOSED}]"}], "params": {"min_cluster_size": 2, "signal_keys": ["mechanism", "problem", "country", "pattern"]}, "side_effect": 0, "sources": ["docs/STATE_OF_BIGQUERY.md §7 (opportunity tiers)", "bigquery/PROTOCOL_ARCHITECTURE.md"], "version": "v1"}