{"description": "Compile an ELIGIBLE thesis + evidence into a campaign spec matching schemas/campaign.schema.v2.json required fields, plus the 10-section campaign shell (market/competitors/catalog/pricing/suppliers/ads/feed/landing/metrics/next-steps). Placeholders stay explicit ('TBD:<what>') — never invented.", "deterministic": true, "inputs": [{"from": "distill-gate-check ELIGIBLE verdict + thesis", "name": "eligible"}, {"from": "template registry (graph shape for vertical)", "name": "template", "required": false}], "op_id": "distill-campaign-compile", "outputs": [{"name": "campaign", "to": "campaign spec {campaign_id, schema_version, track, country, atom, buyer_route, supplier_strategy, distribution_strategy, evidence_bindings, evidence_requirements, experiment, sections[10], unknowns[]}"}], "params": {"schema_version": "v2", "placeholder_marker": "TBD:", "forbid_invention": true}, "side_effect": 1, "sources": ["schemas/campaign.schema.v2.json", "campaigns/active/*.md (10-section shell)", "rubric/PROMPT_GENERATE_CAMPAIGN.md", "rubric/CAMPAIGN_SUBMISSION_CHECKLIST.md"], "version": "v1"}