{"description": "Inventory BigQuery sprawl: table row counts + freshness → candidate pools by type/country, stale/empty flags. Mirrors STATE_OF_BIGQUERY.md §1 as a runnable op.", "deterministic": true, "inputs": [{"from": "BQ table inventory (table, rows, last_updated)", "name": "inventory"}, {"from": "rubric_config.yaml freshness_days (optional)", "name": "freshness_windows", "required": false}], "op_id": "distill-sprawl-scan", "outputs": [{"name": "pools", "to": "candidate pools [{kind, country, count, table}]"}, {"name": "flags", "to": "stale/empty table flags [{table, flag, reason}]"}, {"name": "coverage_gaps", "to": "missing-data list per drop STATE_OF_BIGQUERY §4 pattern"}], "params": {"stale_multiplier": 2.0}, "side_effect": 0, "sources": ["docs/STATE_OF_BIGQUERY.md", "sql/BIGQUERY_DDL.sql"], "version": "v1"}