{"description": "Accumulate a new evidence batch into a growing thesis WITHOUT rewriting history: version bump, appended observations, recomputed confidence, recorded supersessions. This is the snowball step (cf. THESIS.md → THESIS_REFINED.md correction pattern).", "deterministic": true, "inputs": [{"from": "distill-cluster.theses[] or prior snowball output", "name": "thesis"}, {"from": "new observations / probe outcomes / corrections", "name": "evidence_batch"}], "op_id": "distill-snowball", "outputs": [{"name": "thesis_next", "to": "thesis vN+1 {version, observations+, confidence, corrections[], supersedes}"}], "params": {"confidence_rule": "mean of member confidences weighted by basis rank (verified-2026=1.0, govt-data=0.9, well-established=0.7, template-analysis=0.5)", "correction_types": ["downgrade", "narrow-scope", "add-gate", "kill-subclaim"]}, "side_effect": 1, "sources": ["docs/THESIS_REFINED.md (correction pattern)", "LIVE_LEARNING_LOOP.md (promotion across niches)", "ANTI_GOODHART.md"], "version": "v1"}